year	j	panel_ref	panel_track	panel_type	panel_title	panel_description	notes
2022	1	NA	NA	Panel	Political Rhetoric on Immigration	NA	NA
2022	10	NA	NA	Panel	The selection and success of candidates	NA	NA
2022	100	NA	NA	Panel	Fiscal Policy Preferences & Politics	NA	NA
2022	101	NA	NA	Panel	Technological Change & Institutions	NA	NA
2022	102	NA	NA	Panel	Citizen Attitudes and Redistribution 3	NA	NA
2022	103	NA	NA	Panel	Measurement: Polarization and Political Communication	NA	NA
2022	104	NA	NA	Panel	Identity and Civil Conflict	NA	NA
2022	106	NA	NA	Panel	Innovative Applications of Text Analysis to the study of European Union Politics	NA	NA
2022	107	NA	NA	Panel	Experiments in political communication II	NA	NA
2022	108	NA	NA	Panel	Representation and congruence between voters and elites	NA	NA
2022	109	NA	NA	Panel	Party competition and the positions of political parties	NA	NA
2022	11	NA	NA	Panel	Elections & Institutions	NA	NA
2022	110	NA	NA	Panel	International Cooperation and Competition	NA	NA
2022	111	NA	NA	Panel	Terrorism	NA	NA
2022	112	NA	NA	Panel	Effects of Institutions	NA	NA
2022	113	NA	NA	Panel	Populism	NA	NA
2022	114	NA	NA	Panel	Gender and Policy Outcomes	NA	NA
2022	115	NA	NA	Panel	Gender and Politics	NA	NA
2022	117	NA	NA	Panel	Measuring Complex Political Phenomena	NA	NA
2022	118	NA	NA	Panel	Challenger Parties and European Elections	NA	NA
2022	119	NA	NA	Panel	Fake News Experiments	NA	NA
2022	12	NA	NA	Panel	Advances in the Analysis of Electoral Issues	NA	NA
2022	120	NA	NA	Panel	Representation, ethnicity and immigration	NA	NA
2022	121	NA	NA	Panel	Parties, protests and responsiveness	NA	NA
2022	123	NA	NA	Panel	Text-as-data in International Relations	NA	NA
2022	124	NA	NA	Panel	Technological Change & Political Preferences	NA	NA
2022	125	NA	NA	Panel	Populism: the Demand Side	NA	NA
2022	126	NA	NA	Panel	Populist Appeals and Voting Behaviour	NA	NA
2022	127	NA	NA	Panel	Voter Turnout	NA	NA
2022	128	NA	NA	Panel	Participation, Class, Migration	NA	NA
2022	129	NA	NA	Panel	Conflict, Repression and Violence	NA	NA
2022	13	NA	NA	Panel	Legislation	NA	NA
2022	130	NA	NA	Panel	Political Accountability	NA	NA
2022	131	NA	NA	Panel	Survey Methodology	NA	NA
2022	132	NA	NA	Panel	Inequality, Redistribution and Deservingness	NA	NA
2022	133	NA	NA	Panel	Political Institutions, Politicians, and Policymaking	NA	NA
2022	134	NA	NA	Panel	Gender and Political Participation, Behaviour, and Selection	NA	NA
2022	135	NA	NA	Panel	Far-right communication strategies	NA	NA
2022	136	NA	NA	Panel	Representation, gender and diversity	NA	NA
2022	137	NA	NA	Panel	Perceptions of parties in coalition governments	NA	NA
2022	138	NA	NA	Panel	International Law and Legalization	NA	NA
2022	139	NA	NA	Panel	War & Deterrence	NA	NA
2022	14	NA	NA	Panel	Opposition	NA	NA
2022	140	NA	NA	Panel	Understanding Violence	NA	NA
2022	141	NA	NA	Panel	Europe and the European Union	NA	NA
2022	142	NA	NA	Panel	Interest Groups & Political Connections	NA	NA
2022	143	NA	NA	Panel	Migration and Welfare State	NA	NA
2022	144	NA	NA	Panel	Government Formation, Stability and Responsiveness	NA	NA
2022	145	NA	NA	Panel	Race, Gender, and Representation	NA	NA
2022	147	NA	NA	Panel	Measuring and conceptualizing affective polarization beyond the US	NA	NA
2022	148	NA	NA	Panel	Using machine learning tools for measurement and analysis	NA	NA
2022	149	NA	NA	Panel	Female Representation	NA	NA
2022	15	NA	NA	Panel	Institutions and Party Organization	NA	NA
2022	150	NA	NA	Panel	Gender, Elections, and Political Careers	NA	NA
2022	155	NA	NA	Panel	International Organizations	NA	NA
2022	156	NA	NA	Panel	Polarisation, Identity and Race in European Politics	NA	NA
2022	157	NA	NA	Panel	Identity Politics	NA	NA
2022	158	NA	NA	Panel	Party competition and new/old divides	NA	NA
2022	159	NA	NA	Panel	Intra-party politics and party instability	NA	NA
2022	160	NA	NA	Panel	International Norms, Legitimacy, and the Diffusion of Standards	NA	NA
2022	161	NA	NA	Panel	International Organizations II	NA	NA
2022	162	NA	NA	Panel	Interest Groups, Competition & Regulation	NA	NA
2022	163	NA	NA	Panel	Natural Resources, & the Environment	NA	NA
2022	164	NA	NA	Panel	Public Opinion and Exceptional Contexts 1	NA	NA
2022	165	NA	NA	Panel	Public Opinion: Drivers, Mechanisms, and Measurements	NA	NA
2022	166	NA	NA	Panel	Environmental Disasters, Citizen Attitudes and Behaviour	NA	NA
2022	17	NA	NA	Panel	Biases, & Behaviour	NA	NA
2022	178	NA	NA	Panel	Public and Political Dynamics with Public Policy	NA	NA
2022	18	NA	NA	Panel	Economic Crisis	NA	NA
2022	180	NA	NA	Panel	Information consumption	NA	NA
2022	181	NA	NA	Panel	Perceptions of parties and elites	NA	NA
2022	182	NA	NA	Panel	Conflict	NA	NA
2022	184	NA	NA	Panel	Migration: Drivers, Dynamics, Consequences	NA	NA
2022	185	NA	NA	Panel	Politics and Economics in Post-Conflict Settings	NA	NA
2022	188	NA	NA	Panel	Attitudes towards Migrants 1	NA	NA
2022	189	NA	NA	Panel	Information sources	NA	NA
2022	19	NA	NA	Panel	Responsiveness, intra-party politics and interest groups	NA	NA
2022	190	NA	NA	Panel	Representation and electoral systems	NA	NA
2022	191	NA	NA	Panel	Party competition and the environment	NA	NA
2022	192	NA	NA	Panel	Accountability and satisfaction with democracy	NA	NA
2022	193	NA	NA	Panel	International Political Economy	NA	NA
2022	194	NA	NA	Panel	International Relations and Domestic Politics	NA	NA
2022	195	NA	NA	Panel	International Trade	NA	NA
2022	196	NA	NA	Panel	Democratization Processes	NA	NA
2022	198	NA	NA	Panel	Vote Choice: the Effect of Parties and Candidates	NA	NA
2022	199	NA	NA	Panel	Retrospective Voting and Accountability	NA	NA
2022	2	NA	NA	Panel	Conflict: Conventional and Unconventional	NA	NA
2022	20	NA	NA	Panel	Collaboration and competition	NA	NA
2022	200	NA	NA	Panel	Electoral Systems, Strategic Voting and Timing	NA	NA
2022	201	NA	NA	Panel	Party Identification and Issue Voting	NA	NA
2022	202	NA	NA	Panel	Environmental Disasters and Environmental Attitudes	NA	NA
2022	203	NA	NA	Panel	Coalitions and Minority Governments	NA	NA
2022	204	NA	NA	Panel	Multiparty government and policy-making	NA	NA
2022	205	NA	NA	Panel	Protest, Civil Resistance, and Dissent	NA	NA
2022	206	NA	NA	Panel	Public Opinion and Public Diplomacy	NA	NA
2022	207	NA	NA	Panel	Rebel Groups and Militias	NA	NA
2022	208	NA	NA	Panel	Corruption and ways to stop it	NA	NA
2022	21	NA	NA	Panel	Addressing Challenges in the Design of Empirical Analyses	NA	NA
2022	210	NA	NA	Panel	Sources of Attitudes towards Migration	NA	NA
2022	211	NA	NA	Panel	Economic Voting	NA	NA
2022	212	NA	NA	Panel	Trade and Welfare State	NA	NA
2022	213	NA	NA	Panel	Political Behaviour and Ideology	NA	NA
2022	214	NA	NA	Panel	Cues, Emotions, Persuasion	NA	NA
2022	216	NA	NA	Panel	Legislative debates and roll-call voting	NA	NA
2022	218	NA	NA	Panel	Polarization and Geography	NA	NA
2022	219	NA	NA	Panel	Public Opinion, Mobilization and Participation	NA	NA
2022	22	NA	NA	Panel	Causes and Consequences of Sexism	NA	NA
2022	220	NA	NA	Panel	Vote Choice and Parties	NA	NA
2022	221	NA	NA	Panel	Determinants of Public Goods and Voting	NA	NA
2022	222	NA	NA	Panel	Gender Politics	NA	NA
2022	223	NA	NA	Panel	Advances in time series analysis	NA	NA
2022	224	NA	NA	Panel	Distribution and Institutional Reform	NA	NA
2022	225	NA	NA	Panel	Authoritarian Politics	NA	NA
2022	226	NA	NA	Panel	Public Opinion and Exceptional Contexts 2	NA	NA
2022	227	NA	NA	Panel	Citizens and Globalization	NA	NA
2022	229	NA	NA	Panel	Politics of Gender Equality	NA	NA
2022	230	NA	NA	Panel	What's next, Europe? Public Opinion on European Integration	NA	NA
2022	232	NA	NA	Panel	Citizen Attitudes and Redistribution 2	NA	NA
2022	233	NA	NA	Panel	Diversity in political communication	NA	NA
2022	234	NA	NA	Panel	Gender and Political Attitudes	NA	NA
2022	235	NA	NA	Panel	Political Regimes and Citizen Attitudes	NA	NA
2022	236	NA	NA	Panel	Trust and Information	NA	NA
2022	237	NA	NA	Panel	Institutions, Shocks, and Political Support	NA	NA
2022	238	NA	NA	Panel	Party Competition and Citizen Satisfaction	NA	NA
2022	239	NA	NA	Panel	Green Politics	NA	NA
2022	240	NA	NA	Panel	International economics, institutions and politics	NA	NA
2022	241	NA	NA	Panel	Origins of Radical Mobilization	NA	NA
2022	242	NA	NA	Panel	Public Opinion and Contested Issues	NA	NA
2022	244	NA	NA	Panel	Groups, Patronage, Representation	NA	NA
2022	245	NA	NA	Panel	Social Class and Religion	NA	NA
2022	246	NA	NA	Panel	Quality of Democracy and Election Integrity	NA	NA
2022	247	NA	NA	Panel	Cultural Change, Radical Right Voting and LGBT Politics	NA	NA
2022	249	NA	NA	Panel	Redistribution, Welfare State and Trust	NA	NA
2022	25	NA	NA	Panel	Advances in Causal Inference	NA	NA
2022	250	NA	NA	Panel	Polarization and Political Leaders	NA	NA
2022	251	NA	NA	Panel	Populism, Migration and Direct Democracy	NA	NA
2022	252	NA	NA	Panel	Environment, Covid, Globalization	NA	NA
2022	254	NA	NA	Panel	Electoral Manipulation and Election Oversight	NA	NA
2022	255	NA	NA	Panel	Voting Behaviour - Economic Voting and Beyond	NA	NA
2022	256	NA	NA	Panel	Election and Political Violence	NA	NA
2022	257	NA	NA	Panel	Representation : Inclusion and Exclusion	NA	NA
2022	259	NA	NA	Panel	Causes and Consequences of Polarization	NA	NA
2022	26	NA	NA	Panel	Party Organization	NA	NA
2022	260	NA	NA	Panel	Electoral Politics and Electoral Behaviour in Africa	NA	NA
2022	261	NA	NA	Panel	Historical Legacies and Contemporary Politic	NA	NA
2022	262	NA	NA	Panel	Corruption and Clientelism	NA	NA
2022	264	NA	NA	Panel	Mobilization and De-mobilization	NA	NA
2022	265	NA	NA	Panel	Elites and Regime Change	NA	NA
2022	266	NA	NA	Panel	Democratic Backsliding	NA	NA
2022	268	NA	NA	Panel	Politics of Immigration and Anti-Immigration	NA	NA
2022	269	NA	NA	Panel	Media, Disinformation and Propaganda	NA	NA
2022	27	NA	NA	Panel	Decentralization, Diffusion, and Political Power	NA	NA
2022	270	NA	NA	Panel	Voters	NA	NA
2022	271	NA	NA	Panel	Managing the Pandemic	NA	NA
2022	272	NA	NA	Panel	Government Responsiveness	NA	NA
2022	273	NA	NA	Panel	Changing Role(s) of Legislatures	NA	NA
2022	275	NA	NA	Panel	Welfare State, Welfare Chauvinism and Inequality	NA	NA
2022	276	NA	NA	Panel	Domestic Effects of International Politics	NA	NA
2022	277	NA	NA	Panel	Consequences of the Pandemic	NA	NA
2022	278	NA	NA	Panel	Trust and Mistrust	NA	NA
2022	279	NA	NA	Panel	Historical Reserach in Comparative Politics	NA	NA
2022	28	NA	NA	Panel	Parties and MEPs in the European Parliament	NA	NA
2022	29	NA	NA	Panel	Political campaigns and twitter	NA	NA
2022	30	NA	NA	Panel	Autocratic and populist communication	NA	NA
2022	31	NA	NA	Panel	Party positioning and responsiveness to societal change	NA	NA
2022	32	NA	NA	Panel	Climate Change and Contentious Politics	NA	NA
2022	33	NA	NA	Panel	Polarization and Political Psychology	NA	NA
2022	34	NA	NA	Panel	Polarization, Elites and Ideologies	NA	NA
2022	36	NA	NA	Panel	Political Elites and Regime Change	NA	NA
2022	37	NA	NA	Panel	Lobbying & Transparency	NA	NA
2022	38	NA	NA	Panel	Gender and parliaments	NA	NA
2022	39	NA	NA	Panel	Analyzing Politics and Public Policy	NA	NA
2022	4	NA	NA	Panel	Democratic Backsliding I	NA	NA
2022	40	NA	NA	Panel	Transnational Aspects of the European Union: Policymaking Processes and Member States' Reactions	NA	NA
2022	42	NA	NA	Panel	Parties, factions and activists	NA	NA
2022	43	NA	NA	Panel	Issue competition among political parties	NA	NA
2022	44	NA	NA	Panel	Climate Change, Ecocide, and Environmental Treaties	NA	NA
2022	46	NA	NA	Panel	Cleavages and Vote Choice	NA	NA
2022	48	NA	NA	Panel	Bureaucracy and Business	NA	NA
2022	5	NA	NA	Panel	Candidates	NA	NA
2022	50	NA	NA	Panel	Content of political communication II	NA	NA
2022	51	NA	NA	Panel	Economic Policymaking and International Cooperation in the European Union	NA	NA
2022	52	NA	NA	Panel	Social Media and Covid-19	NA	NA
2022	53	NA	NA	Panel	Parties and political elites	NA	NA
2022	54	NA	NA	Panel	Consequences and Legacies of Violence	NA	NA
2022	55	NA	NA	Panel	Ethnic Conflict, Power-sharing, and Intergroup Contact	NA	NA
2022	56	NA	NA	Panel	Sanctions: Initiation, Effects, and Termination	NA	NA
2022	57	NA	NA	Panel	Migration	NA	NA
2022	58	NA	NA	Panel	Patronage & Accountability	NA	NA
2022	59	NA	NA	Panel	Citizens and Taxation	NA	NA
2022	6	NA	NA	Panel	Political careers	NA	NA
2022	60	NA	NA	Panel	Inequality, Participation and Basic Income	NA	NA
2022	61	NA	NA	Panel	Causality, Prediction and Other Core Methodological Issues	NA	NA
2022	62	NA	NA	Panel	Electoral Politics	NA	NA
2022	63	NA	NA	Panel	Policy Representation and Responsiveness in the European Union	NA	NA
2022	64	NA	NA	Panel	Post-Colonial Politics in Africa	NA	NA
2022	65	NA	NA	Panel	Media, Communication, & Politics	NA	NA
2022	66	NA	NA	Panel	Evaluation of political candidates	NA	NA
2022	67	NA	NA	Panel	Party system change and programmatic competition	NA	NA
2022	7	NA	NA	Panel	Electoral Systems	NA	NA
2022	71	NA	NA	Panel	Experiments on Corruption	NA	NA
2022	72	NA	NA	Panel	Preferences for Redistribution	NA	NA
2022	73	NA	NA	Panel	Citizen Attitudes and Redistribution 1	NA	NA
2022	74	NA	NA	Panel	Political elites & affective polarization	NA	NA
2022	76	NA	NA	Panel	Democratic Backsliding II	NA	NA
2022	77	NA	NA	Panel	Comparative Judicial Politics	NA	NA
2022	78	NA	NA	Panel	Gender and Equality	NA	NA
2022	79	NA	NA	Panel	Issues and Topics	NA	NA
2022	8	NA	NA	Panel	Alliances	NA	NA
2022	80	NA	NA	Panel	Theoretical Implications of Empirical Models	NA	NA
2022	81	NA	NA	Panel	Challenges in text analysis: bias, multilingualism, and others	NA	NA
2022	82	NA	NA	Panel	Judicial Politics	NA	NA
2022	83	NA	NA	Panel	Policy Consultation and Policy Complexity in the European Union	NA	NA
2022	84	NA	NA	Panel	Experiments in political communication I	NA	NA
2022	86	NA	NA	Panel	Ideological and affective polarization	NA	NA
2022	87	NA	NA	Panel	Secessionism, Irredentism, and Territorial Control	NA	NA
2022	88	NA	NA	Panel	Income Inequality & Institutions	NA	NA
2022	89	NA	NA	Panel	European Social Democracy in Demise	NA	NA
2022	9	NA	NA	Panel	Agenda Setting and Media Coverage	NA	NA
2022	90	NA	NA	Panel	Women and European Politics	NA	NA
2022	91	NA	NA	Panel	Parliamentary Unity and Conflict	NA	NA
2022	92	NA	NA	Panel	Measurement: How parties and elites communicate	NA	NA
2022	93	NA	NA	Panel	New Political Contexts and Changing Political Actors	NA	NA
2022	94	NA	NA	Panel	Public Attitudes towards the European Union and its Institutions	NA	NA
2022	96	NA	NA	Panel	Populism and the radical right	NA	NA
2022	97	NA	NA	Panel	Party competition and challenger parties	NA	NA
2022	98	NA	NA	Panel	Human Rights	NA	NA
2022	99	NA	NA	Panel	Technology and Conflict	NA	NA
